{
  "$schema": "./cutover-record.schema.json",
  "schemaVersion": 1,
  "featureId": "advances-and-repayments",
  "dataClassification": "synthetic",
  "status": {
    "current": "preparation",
    "changedAt": "2026-09-16T12:35:24Z",
    "history": [{"state": "preparation", "at": "2026-09-16T12:35:24Z", "reason": "Advance and repayment contracts are approved; legacy reads and writes remain authoritative until Part 9C passes."}]
  },
  "dependencies": {
    "inventorySource": "docs/migration/phase-9/PART_9A_DEPENDENCY_INVENTORY.md",
    "requiredIds": ["advance-storage", "advance-schedule", "advance-rpcs"],
    "declared": [
      {"id": "advance-storage", "system": "legacy-supabase", "kind": "module", "locator": "src/utils/storage.js", "cutoverDisposition": "retain"},
      {"id": "advance-schedule", "system": "legacy-supabase", "kind": "module", "locator": "src/utils/advanceSchedule.js", "cutoverDisposition": "retain"},
      {"id": "advance-rpcs", "system": "legacy-supabase", "kind": "data-contract", "locator": "sql/051_employee_request_actions.sql", "cutoverDisposition": "retain"}
    ]
  },
  "authority": {"readSystem": "legacy-supabase", "writeSystem": "legacy-supabase", "writableSystems": ["legacy-supabase"]},
  "freeze": {
    "read": {
      "system": "migration-fastapi",
      "condition": "Migration advance lists remain disabled during preparation.",
      "releaseCondition": "Part 9C proves self and branch-scoped reads and records active cutover.",
      "verificationCommand": "node scripts/cutover-record-validator.mjs docs/migration/phase-9/cutover/advances-and-repayments.json"
    },
    "write": {
      "system": "migration-fastapi",
      "condition": "Migration request, decision, schedule, repayment, and settlement commands remain disabled.",
      "releaseCondition": "Part 9C proves exact balances, concurrency, idempotency, and the legacy writer freeze.",
      "verificationCommand": "node scripts/cutover-record-validator.mjs docs/migration/phase-9/cutover/advances-and-repayments.json"
    }
  },
  "refresh": {
    "mode": "synthetic-only",
    "source": {"kind": "tracked-fixture", "locator": "docs/migration/phase-9/PART_9A_GOLDEN_CASES.md", "digest": "sha256:db900bd5134a67f3523ca276af6cbed198ca2c1423f8ea31e5bcbcb7bde7f552"},
    "command": "node scripts/cutover-record-validator.mjs docs/migration/phase-9/cutover/advances-and-repayments.json",
    "lastRefresh": {
      "timestamp": "2026-09-16T12:35:24Z",
      "command": "node scripts/cutover-record-validator.mjs docs/migration/phase-9/cutover/advances-and-repayments.json",
      "sourceDigest": "sha256:db900bd5134a67f3523ca276af6cbed198ca2c1423f8ea31e5bcbcb7bde7f552",
      "evidence": {"path": "docs/migration/phase-9/cutover/evidence-advances-and-repayments.json", "sha256": "sha256:20f546a7d9e00216428751ec24f4b43fcd56c1db2bca4036344a0cf6e8870b7f"}
    }
  },
  "identityMapping": {
    "mode": "synthetic-only",
    "legacyIdField": "legacySupabaseUserId",
    "applicationIdField": "applicationUserId",
    "requiredLegacyUserIds": ["11111111-1111-4111-8111-111111111111"],
    "mappings": [{"legacySupabaseUserId": "11111111-1111-4111-8111-111111111111", "applicationUserId": "10000000-0000-4000-8000-000000000001", "synthetic": true}]
  },
  "rollback": {
    "trigger": "Part 9C schedule, repayment, scope, transaction, or audit proof fails after active cutover.",
    "owner": "phase-owner",
    "targetAuthority": {"readSystem": "legacy-supabase", "writeSystem": "legacy-supabase", "writableSystems": ["legacy-supabase"]},
    "steps": [
      {"id": "freeze-migration-writes", "action": "Disable migration advance and repayment mutations.", "verificationCommand": "node scripts/cutover-record-validator.mjs docs/migration/phase-9/cutover/advances-and-repayments.json"},
      {"id": "restore-legacy-writes", "action": "Restore legacy advance and repayment mutations as sole writers.", "verificationCommand": "node scripts/cutover-record-validator.mjs docs/migration/phase-9/cutover/advances-and-repayments.json"},
      {"id": "restore-legacy-reads", "action": "Route advance reads to the legacy application.", "verificationCommand": "node scripts/cutover-record-validator.mjs docs/migration/phase-9/cutover/advances-and-repayments.json"},
      {"id": "verify-authority", "action": "Verify one writable system and employee and branch scope.", "verificationCommand": "node scripts/cutover-record-validator.mjs docs/migration/phase-9/cutover/advances-and-repayments.json"},
      {"id": "verify-data", "action": "Compare synthetic balances and retain repayment and settled history.", "verificationCommand": "node scripts/cutover-record-validator.mjs docs/migration/phase-9/cutover/advances-and-repayments.json"}
    ]
  },
  "validation": {"asOf": "2026-09-16T12:35:24Z", "refreshMaxAgeHours": 168}
}
