{
  "$schema": "./cutover-record.schema.json", "schemaVersion": 1, "featureId": "attendance-event-ingestion", "dataClassification": "synthetic",
  "status": {"current": "completed", "changedAt": "2026-09-20T16:45:59Z", "history": [{"state": "preparation", "at": "2026-09-18T08:00:00Z", "reason": "The 10A event contract is approved; legacy manual and biometric ingestion remains authoritative until 10C passes."}, {"state": "active-cutover", "at": "2026-09-20T16:45:58Z", "reason": "Phase 10C scope, replay, provenance, pagination, audit, RLS, grant, restart, and browser checks passed with synthetic data."}, {"state": "completed", "at": "2026-09-20T16:45:59Z", "reason": "Migration event ingestion is authoritative and matching legacy writers fail closed."}]},
  "dependencies": {"inventorySource": "docs/migration/phase-10/PART_10A_DEPENDENCY_INVENTORY.md", "requiredIds": ["clock-biometric-ingestion"], "declared": [{"id": "clock-biometric-ingestion", "system": "legacy-supabase", "kind": "module", "locator": "src/utils/biometricStorage.js", "cutoverDisposition": "replace"}]},
  "authority": {"readSystem": "migration-fastapi", "writeSystem": "migration-fastapi", "writableSystems": ["migration-fastapi"]},
  "freeze": {"read": {"system": "legacy-supabase", "condition": "The migration attendance-ingestion screen and personal event projection read only FastAPI; there is no legacy fallback.", "releaseCondition": "Rollback disables migration event authority before restoring legacy event reads.", "verificationCommand": "node --test tests/migration-attendance-ingestion.test.js"}, "write": {"system": "legacy-supabase", "condition": "Legacy manual clock-event, biometric-mapping, and biometric-import writers fail closed.", "releaseCondition": "Rollback disables migration ingestion before restoring one legacy writer.", "verificationCommand": "node --test tests/phase-10c-legacy-freeze.test.js"}},
  "refresh": {"mode": "synthetic-only", "source": {"kind": "tracked-fixture", "locator": "docs/migration/phase-10/PART_10A_GOLDEN_CASES.md", "digest": "sha256:e0fcce294e309612dbf15cf0379899aea4b76217ad7be93834ec6ed1aca1120c"}, "command": "python scripts/verify-phase-10c-database.py", "lastRefresh": {"timestamp": "2026-09-20T16:45:59Z", "command": "python scripts/verify-phase-10c-database.py", "sourceDigest": "sha256:e0fcce294e309612dbf15cf0379899aea4b76217ad7be93834ec6ed1aca1120c", "evidence": {"path": "docs/migration/phase-10/cutover/evidence-event-ingestion.json", "sha256": "sha256:d7601b152438b656af3e8eb6bf70b06dd347028a0c07ac04435c24b1a21a3fa7"}}},
  "identityMapping": {"mode": "synthetic-only", "legacyIdField": "legacySupabaseUserId", "applicationIdField": "applicationUserId", "requiredLegacyUserIds": ["11111111-1111-4111-8111-111111111111"], "mappings": [{"legacySupabaseUserId": "11111111-1111-4111-8111-111111111111", "applicationUserId": "10000000-0000-4000-8000-000000000001", "synthetic": true}]},
  "rollback": {"trigger": "The 10C ingestion boundary fails after cutover.", "owner": "phase-owner", "targetAuthority": {"readSystem": "legacy-supabase", "writeSystem": "legacy-supabase", "writableSystems": ["legacy-supabase"]}, "steps": [{"id": "freeze-migration-writes", "action": "Disable migration ingestion.", "verificationCommand": "node scripts/cutover-record-validator.mjs docs/migration/phase-10/cutover/attendance-event-ingestion.json"}, {"id": "restore-legacy-writes", "action": "Restore the legacy event writer.", "verificationCommand": "node scripts/cutover-record-validator.mjs docs/migration/phase-10/cutover/attendance-event-ingestion.json"}, {"id": "restore-legacy-reads", "action": "Restore legacy event reads.", "verificationCommand": "node scripts/cutover-record-validator.mjs docs/migration/phase-10/cutover/attendance-event-ingestion.json"}, {"id": "verify-authority", "action": "Verify one event writer.", "verificationCommand": "node scripts/cutover-record-validator.mjs docs/migration/phase-10/cutover/attendance-event-ingestion.json"}, {"id": "verify-data", "action": "Compare event IDs, fingerprints, and batch outcomes.", "verificationCommand": "node scripts/cutover-record-validator.mjs docs/migration/phase-10/cutover/attendance-event-ingestion.json"}]},
  "validation": {"asOf": "2026-09-20T16:45:59Z", "refreshMaxAgeHours": 24}
}
