{
  "$schema": "./cutover-record.schema.json",
  "schemaVersion": 1,
  "featureId": "wps-and-nafis",
  "dataClassification": "synthetic",
  "status": {"current": "preparation", "changedAt": "2026-09-16T12:35:24Z", "history": [{"state": "preparation", "at": "2026-09-16T12:35:24Z", "reason": "WPS, SIF input, compliance, and Nafis contracts are approved; legacy reads and writes remain authoritative until Part 9G passes."}]},
  "dependencies": {
    "inventorySource": "docs/migration/phase-9/PART_9A_DEPENDENCY_INVENTORY.md",
    "requiredIds": ["wps-storage", "sif-generator", "sif-compliance", "nafis-storage"],
    "declared": [
      {"id": "wps-storage", "system": "legacy-supabase", "kind": "module", "locator": "src/utils/storage.js", "cutoverDisposition": "retain"},
      {"id": "sif-generator", "system": "legacy-supabase", "kind": "module", "locator": "src/utils/sifGenerator.js", "cutoverDisposition": "retain"},
      {"id": "sif-compliance", "system": "legacy-supabase", "kind": "module", "locator": "src/utils/sifCompliance.js", "cutoverDisposition": "retain"},
      {"id": "nafis-storage", "system": "legacy-supabase", "kind": "data-contract", "locator": "sql/001_emiratization.sql", "cutoverDisposition": "retain"}
    ]
  },
  "authority": {"readSystem": "legacy-supabase", "writeSystem": "legacy-supabase", "writableSystems": ["legacy-supabase"]},
  "freeze": {
    "read": {"system": "migration-fastapi", "condition": "Migration WPS, SIF input, compliance, and Nafis reads remain disabled during preparation.", "releaseCondition": "Part 9G proves scoped deterministic projections and records active cutover.", "verificationCommand": "node scripts/cutover-record-validator.mjs docs/migration/phase-9/cutover/wps-and-nafis.json"},
    "write": {"system": "migration-fastapi", "condition": "Migration WPS transitions, overrides, and Nafis snapshot commands remain disabled.", "releaseCondition": "Part 9G proves transitions, corrections, audit, and the legacy writer freeze.", "verificationCommand": "node scripts/cutover-record-validator.mjs docs/migration/phase-9/cutover/wps-and-nafis.json"}
  },
  "refresh": {
    "mode": "synthetic-only",
    "source": {"kind": "tracked-fixture", "locator": "docs/migration/phase-9/PART_9A_GOLDEN_CASES.md", "digest": "sha256:db900bd5134a67f3523ca276af6cbed198ca2c1423f8ea31e5bcbcb7bde7f552"},
    "command": "node scripts/cutover-record-validator.mjs docs/migration/phase-9/cutover/wps-and-nafis.json",
    "lastRefresh": {"timestamp": "2026-09-16T12:35:24Z", "command": "node scripts/cutover-record-validator.mjs docs/migration/phase-9/cutover/wps-and-nafis.json", "sourceDigest": "sha256:db900bd5134a67f3523ca276af6cbed198ca2c1423f8ea31e5bcbcb7bde7f552", "evidence": {"path": "docs/migration/phase-9/cutover/evidence-wps-and-nafis.json", "sha256": "sha256:4f5f4675a0b6ea4092d7cc3ed9451fedf5fd873aee70e3bd08292e59e80f48a2"}}
  },
  "identityMapping": {"mode": "synthetic-only", "legacyIdField": "legacySupabaseUserId", "applicationIdField": "applicationUserId", "requiredLegacyUserIds": ["11111111-1111-4111-8111-111111111111"], "mappings": [{"legacySupabaseUserId": "11111111-1111-4111-8111-111111111111", "applicationUserId": "10000000-0000-4000-8000-000000000001", "synthetic": true}]},
  "rollback": {
    "trigger": "Part 9G WPS transition, SIF projection, override, or Nafis proof fails after active cutover.",
    "owner": "phase-owner",
    "targetAuthority": {"readSystem": "legacy-supabase", "writeSystem": "legacy-supabase", "writableSystems": ["legacy-supabase"]},
    "steps": [
      {"id": "freeze-migration-writes", "action": "Disable migration WPS, compliance, and Nafis mutations.", "verificationCommand": "node scripts/cutover-record-validator.mjs docs/migration/phase-9/cutover/wps-and-nafis.json"},
      {"id": "restore-legacy-writes", "action": "Restore legacy WPS, compliance, and Nafis paths as sole writers.", "verificationCommand": "node scripts/cutover-record-validator.mjs docs/migration/phase-9/cutover/wps-and-nafis.json"},
      {"id": "restore-legacy-reads", "action": "Route WPS, SIF, compliance, and Nafis reads to the legacy application.", "verificationCommand": "node scripts/cutover-record-validator.mjs docs/migration/phase-9/cutover/wps-and-nafis.json"},
      {"id": "verify-authority", "action": "Verify one writable system and selected-branch administrator scope.", "verificationCommand": "node scripts/cutover-record-validator.mjs docs/migration/phase-9/cutover/wps-and-nafis.json"},
      {"id": "verify-data", "action": "Preserve submitted and confirmed WPS history, overrides, and Nafis snapshots.", "verificationCommand": "node scripts/cutover-record-validator.mjs docs/migration/phase-9/cutover/wps-and-nafis.json"}
    ]
  },
  "validation": {"asOf": "2026-09-16T12:35:24Z", "refreshMaxAgeHours": 168}
}
