{
  "$schema": "./cutover-record.schema.json",
  "schemaVersion": 1,
  "featureId": "letter-requests",
  "dataClassification": "synthetic",
  "status": {
    "current": "completed",
    "changedAt": "2026-09-23T17:00:00Z",
    "history": [
      {"state": "preparation", "at": "2026-09-22T08:00:00Z", "reason": "The 11A request contract is drafted; legacy request paths remain authoritative until 11F passes."},
      {"state": "active-cutover", "at": "2026-09-23T16:59:59Z", "reason": "Phase 11F request API, snapshot, authorization, decision, rollback, and frontend checks passed with synthetic data."},
      {"state": "completed", "at": "2026-09-23T17:00:00Z", "reason": "Migration request reads and commands are authoritative; matching legacy paths fail closed."}
    ]
  },
  "dependencies": {
    "inventorySource": "docs/migration/phase-11/PART_11A_DEPENDENCY_INVENTORY.md",
    "requiredIds": ["letter-requests"],
    "declared": [{"id": "letter-requests", "system": "legacy-supabase", "kind": "module", "locator": "src/utils/letterStorage.js", "cutoverDisposition": "replace"}]
  },
  "authority": {"readSystem": "migration-fastapi", "writeSystem": "migration-fastapi", "writableSystems": ["migration-fastapi"]},
  "freeze": {
    "read": {"system": "legacy-supabase", "condition": "Legacy request reads fail closed; migration self and selected-branch reads have no legacy fallback.", "releaseCondition": "Rollback disables migration request reads before restoring legacy readers.", "verificationCommand": "node --test tests/phase-11f-legacy-freeze.test.js"},
    "write": {"system": "legacy-supabase", "condition": "Legacy request RPCs, table writes, and decisions fail closed; migration commands are the sole writers.", "releaseCondition": "Rollback disables migration submissions and decisions before restoring one legacy writer.", "verificationCommand": "node --test tests/phase-11f-legacy-freeze.test.js"}
  },
  "refresh": {
    "mode": "synthetic-only",
    "source": {"kind": "tracked-fixture", "locator": "docs/migration/phase-11/PART_11A_GOLDEN_CASES.md", "digest": "sha256:05a3a237ddd714b020771bb6cf3b45ad481155b53713c57502eb19f3a8339713"},
    "command": "python scripts/verify-phase-11f-database.py",
    "lastRefresh": {
      "timestamp": "2026-09-23T17:00:00Z",
      "command": "python scripts/verify-phase-11f-database.py",
      "sourceDigest": "sha256:05a3a237ddd714b020771bb6cf3b45ad481155b53713c57502eb19f3a8339713",
      "evidence": {"path": "docs/migration/phase-11/cutover/evidence-letter-requests.json", "sha256": "sha256:8e45aca60fdb9602a62ad36e46ee5a0c598824b261460ab2a971cfd500cbeab8"}
    }
  },
  "identityMapping": {"mode": "synthetic-only", "legacyIdField": "legacySupabaseUserId", "applicationIdField": "applicationUserId", "requiredLegacyUserIds": ["11111111-1111-4111-8111-111111111111"], "mappings": [{"legacySupabaseUserId": "11111111-1111-4111-8111-111111111111", "applicationUserId": "10000000-0000-4000-8000-000000000001", "synthetic": true}]},
  "rollback": {
    "trigger": "The 11F request boundary fails after cutover.",
    "owner": "phase-owner",
    "targetAuthority": {"readSystem": "legacy-supabase", "writeSystem": "legacy-supabase", "writableSystems": ["legacy-supabase"]},
    "steps": [
      {"id": "freeze-migration-writes", "action": "Disable migration request decisions and submissions.", "verificationCommand": "node scripts/cutover-record-validator.mjs docs/migration/phase-11/cutover/letter-requests.json"},
      {"id": "restore-legacy-writes", "action": "Restore legacy request writes as sole writers.", "verificationCommand": "node scripts/cutover-record-validator.mjs docs/migration/phase-11/cutover/letter-requests.json"},
      {"id": "restore-legacy-reads", "action": "Restore legacy request reads while Phase 12 remains responsible for rendered output.", "verificationCommand": "node scripts/cutover-record-validator.mjs docs/migration/phase-11/cutover/letter-requests.json"},
      {"id": "verify-authority", "action": "Verify one request writer and each self and selected-branch reader.", "verificationCommand": "node scripts/cutover-record-validator.mjs docs/migration/phase-11/cutover/letter-requests.json"},
      {"id": "verify-data", "action": "Compare requests, trusted snapshots, decisions, actors, and timestamps.", "verificationCommand": "node scripts/cutover-record-validator.mjs docs/migration/phase-11/cutover/letter-requests.json"}
    ]
  },
  "validation": {"asOf": "2026-09-23T17:00:00Z", "refreshMaxAgeHours": 24}
}
