{
  "$schema": "./cutover-record.schema.json", "schemaVersion": 1, "featureId": "attendance-period-close", "dataClassification": "synthetic",
  "status": {"current": "completed", "changedAt": "2026-09-21T21:13:06Z", "history": [{"state": "preparation", "at": "2026-09-18T08:00:00Z", "reason": "The 10A close and payroll projection contract is approved; legacy close remains authoritative until 10F passes."}, {"state": "active-cutover", "at": "2026-09-21T21:13:05Z", "reason": "Phase 10F close, amendment, projection, database, payroll-integration, and frontend checks passed with synthetic data."}, {"state": "completed", "at": "2026-09-21T21:13:06Z", "reason": "Migration period reads, close, amendments, and payroll projection are authoritative and matching legacy paths fail closed."}]},
  "dependencies": {"inventorySource": "docs/migration/phase-10/PART_10A_DEPENDENCY_INVENTORY.md", "requiredIds": ["period-close-projection"], "declared": [{"id": "period-close-projection", "system": "legacy-supabase", "kind": "data-contract", "locator": "src/utils/attendanceStorage.js", "cutoverDisposition": "replace"}]},
  "authority": {"readSystem": "migration-fastapi", "writeSystem": "migration-fastapi", "writableSystems": ["migration-fastapi"]},
  "freeze": {"read": {"system": "legacy-supabase", "condition": "Migration period and payroll-input screens read only FastAPI; there is no legacy fallback.", "releaseCondition": "Rollback disables migration close and payroll refresh before restoring legacy reads.", "verificationCommand": "node --test tests/migration-attendance-periods.test.js tests/phase-10f-legacy-freeze.test.js"}, "write": {"system": "legacy-supabase", "condition": "Legacy period-close writers and attendance-payroll readers fail closed.", "releaseCondition": "Rollback disables migration close before restoring one legacy writer.", "verificationCommand": "node --test tests/phase-10f-legacy-freeze.test.js"}},
  "refresh": {"mode": "synthetic-only", "source": {"kind": "tracked-fixture", "locator": "docs/migration/phase-10/PART_10A_GOLDEN_CASES.md", "digest": "sha256:e0fcce294e309612dbf15cf0379899aea4b76217ad7be93834ec6ed1aca1120c"}, "command": "python scripts/verify-phase-10f-database.py", "lastRefresh": {"timestamp": "2026-09-21T21:13:06Z", "command": "python scripts/verify-phase-10f-database.py", "sourceDigest": "sha256:e0fcce294e309612dbf15cf0379899aea4b76217ad7be93834ec6ed1aca1120c", "evidence": {"path": "docs/migration/phase-10/cutover/evidence-period-close.json", "sha256": "sha256:5bd45d96ba777c28901225642d64cfcc26e192a3408b28f23c0a7ab65ea678aa"}}},
  "identityMapping": {"mode": "synthetic-only", "legacyIdField": "legacySupabaseUserId", "applicationIdField": "applicationUserId", "requiredLegacyUserIds": ["11111111-1111-4111-8111-111111111111"], "mappings": [{"legacySupabaseUserId": "11111111-1111-4111-8111-111111111111", "applicationUserId": "10000000-0000-4000-8000-000000000001", "synthetic": true}]},
  "rollback": {"trigger": "The 10F close or projection boundary fails after cutover.", "owner": "phase-owner", "targetAuthority": {"readSystem": "legacy-supabase", "writeSystem": "legacy-supabase", "writableSystems": ["legacy-supabase"]}, "steps": [{"id": "freeze-migration-writes", "action": "Disable migration close and Phase 9 attendance refresh.", "verificationCommand": "node scripts/cutover-record-validator.mjs docs/migration/phase-10/cutover/attendance-period-close.json"}, {"id": "restore-legacy-writes", "action": "Restore legacy close as sole writer.", "verificationCommand": "node scripts/cutover-record-validator.mjs docs/migration/phase-10/cutover/attendance-period-close.json"}, {"id": "restore-legacy-reads", "action": "Restore legacy attendance payroll reads.", "verificationCommand": "node scripts/cutover-record-validator.mjs docs/migration/phase-10/cutover/attendance-period-close.json"}, {"id": "verify-authority", "action": "Verify one close writer and projection source.", "verificationCommand": "node scripts/cutover-record-validator.mjs docs/migration/phase-10/cutover/attendance-period-close.json"}, {"id": "verify-data", "action": "Compare closed versions, source rows, money, and payroll snapshots.", "verificationCommand": "node scripts/cutover-record-validator.mjs docs/migration/phase-10/cutover/attendance-period-close.json"}]},
  "validation": {"asOf": "2026-09-21T21:13:06Z", "refreshMaxAgeHours": 24}
}
