{
  "$schema": "./cutover-record.schema.json", "schemaVersion": 1, "featureId": "roster-publication", "dataClassification": "synthetic",
  "status": {"current": "preparation", "changedAt": "2026-09-18T08:00:00Z", "history": [{"state": "preparation", "at": "2026-09-18T08:00:00Z", "reason": "The 10A publication, actual-hours, schedule, and payroll projection contract is approved; legacy publication remains authoritative until 10H passes."}]},
  "dependencies": {"inventorySource": "docs/migration/phase-10/PART_10A_DEPENDENCY_INVENTORY.md", "requiredIds": ["roster-publication-projection"], "declared": [{"id": "roster-publication-projection", "system": "legacy-supabase", "kind": "data-contract", "locator": "src/components/RosterManager.jsx", "cutoverDisposition": "replace"}]},
  "authority": {"readSystem": "legacy-supabase", "writeSystem": "legacy-supabase", "writableSystems": ["legacy-supabase"]},
  "freeze": {"read": {"system": "migration-fastapi", "condition": "Migration schedule and roster payroll reads remain unavailable before 10H.", "releaseCondition": "Enable after publication and projection proof.", "verificationCommand": "node scripts/cutover-record-validator.mjs docs/migration/phase-10/cutover/roster-publication.json"}, "write": {"system": "migration-fastapi", "condition": "Migration publication and actual-hours commands remain unavailable before 10H.", "releaseCondition": "Freeze legacy publication before enabling them.", "verificationCommand": "node scripts/cutover-record-validator.mjs docs/migration/phase-10/cutover/roster-publication.json"}},
  "refresh": {"mode": "synthetic-only", "source": {"kind": "tracked-fixture", "locator": "docs/migration/phase-10/PART_10A_GOLDEN_CASES.md", "digest": "sha256:e0fcce294e309612dbf15cf0379899aea4b76217ad7be93834ec6ed1aca1120c"}, "command": "node scripts/cutover-record-validator.mjs docs/migration/phase-10/cutover/roster-publication.json", "lastRefresh": {"timestamp": "2026-09-18T08:00:00Z", "command": "node scripts/cutover-record-validator.mjs docs/migration/phase-10/cutover/roster-publication.json", "sourceDigest": "sha256:e0fcce294e309612dbf15cf0379899aea4b76217ad7be93834ec6ed1aca1120c", "evidence": {"path": "docs/migration/phase-10/cutover/evidence-roster-publication.json", "sha256": "sha256:28000e3ba714de7363334ebb47bc4b548d5edcc55a0921c8c9e1faef8d40db7e"}}},
  "identityMapping": {"mode": "synthetic-only", "legacyIdField": "legacySupabaseUserId", "applicationIdField": "applicationUserId", "requiredLegacyUserIds": ["11111111-1111-4111-8111-111111111111"], "mappings": [{"legacySupabaseUserId": "11111111-1111-4111-8111-111111111111", "applicationUserId": "10000000-0000-4000-8000-000000000001", "synthetic": true}]},
  "rollback": {"trigger": "The 10H publication or projection boundary fails after cutover.", "owner": "phase-owner", "targetAuthority": {"readSystem": "legacy-supabase", "writeSystem": "legacy-supabase", "writableSystems": ["legacy-supabase"]}, "steps": [{"id": "freeze-migration-writes", "action": "Disable migration publication, actual-hours, and Phase 9 roster refresh.", "verificationCommand": "node scripts/cutover-record-validator.mjs docs/migration/phase-10/cutover/roster-publication.json"}, {"id": "restore-legacy-writes", "action": "Restore legacy publication as sole writer.", "verificationCommand": "node scripts/cutover-record-validator.mjs docs/migration/phase-10/cutover/roster-publication.json"}, {"id": "restore-legacy-reads", "action": "Restore legacy schedule and roster payroll reads.", "verificationCommand": "node scripts/cutover-record-validator.mjs docs/migration/phase-10/cutover/roster-publication.json"}, {"id": "verify-authority", "action": "Verify one publication and actual-hours writer.", "verificationCommand": "node scripts/cutover-record-validator.mjs docs/migration/phase-10/cutover/roster-publication.json"}, {"id": "verify-data", "action": "Compare publication versions, evidence, source IDs, and payroll snapshots.", "verificationCommand": "node scripts/cutover-record-validator.mjs docs/migration/phase-10/cutover/roster-publication.json"}]},
  "validation": {"asOf": "2026-09-18T08:00:00Z", "refreshMaxAgeHours": 24}
}
