{
  "$schema": "./cutover-record.schema.json", "schemaVersion": 1, "featureId": "shift-swaps", "dataClassification": "synthetic",
  "status": {"current": "preparation", "changedAt": "2026-09-18T08:00:00Z", "history": [{"state": "preparation", "at": "2026-09-18T08:00:00Z", "reason": "The 10A swap and publication-version contract is approved; legacy swap paths remain authoritative until 10I passes."}]},
  "dependencies": {"inventorySource": "docs/migration/phase-10/PART_10A_DEPENDENCY_INVENTORY.md", "requiredIds": ["shift-swap-workflow"], "declared": [{"id": "shift-swap-workflow", "system": "legacy-supabase", "kind": "module", "locator": "src/utils/attendanceStorage.js", "cutoverDisposition": "replace"}]},
  "authority": {"readSystem": "legacy-supabase", "writeSystem": "legacy-supabase", "writableSystems": ["legacy-supabase"]},
  "freeze": {"read": {"system": "migration-fastapi", "condition": "Migration swap reads remain unavailable before 10I.", "releaseCondition": "Enable only with swap cutover.", "verificationCommand": "node scripts/cutover-record-validator.mjs docs/migration/phase-10/cutover/shift-swaps.json"}, "write": {"system": "migration-fastapi", "condition": "Migration swap commands remain unavailable before 10I.", "releaseCondition": "Freeze legacy swap writers before enabling them.", "verificationCommand": "node scripts/cutover-record-validator.mjs docs/migration/phase-10/cutover/shift-swaps.json"}},
  "refresh": {"mode": "synthetic-only", "source": {"kind": "tracked-fixture", "locator": "docs/migration/phase-10/PART_10A_GOLDEN_CASES.md", "digest": "sha256:e0fcce294e309612dbf15cf0379899aea4b76217ad7be93834ec6ed1aca1120c"}, "command": "node scripts/cutover-record-validator.mjs docs/migration/phase-10/cutover/shift-swaps.json", "lastRefresh": {"timestamp": "2026-09-18T08:00:00Z", "command": "node scripts/cutover-record-validator.mjs docs/migration/phase-10/cutover/shift-swaps.json", "sourceDigest": "sha256:e0fcce294e309612dbf15cf0379899aea4b76217ad7be93834ec6ed1aca1120c", "evidence": {"path": "docs/migration/phase-10/cutover/evidence-shift-swaps.json", "sha256": "sha256:49d55b48d888309b8801194e438e10661a412e5eb2172ebc65f17be3017f3c32"}}},
  "identityMapping": {"mode": "synthetic-only", "legacyIdField": "legacySupabaseUserId", "applicationIdField": "applicationUserId", "requiredLegacyUserIds": ["11111111-1111-4111-8111-111111111111"], "mappings": [{"legacySupabaseUserId": "11111111-1111-4111-8111-111111111111", "applicationUserId": "10000000-0000-4000-8000-000000000001", "synthetic": true}]},
  "rollback": {"trigger": "The 10I swap boundary fails after cutover.", "owner": "phase-owner", "targetAuthority": {"readSystem": "legacy-supabase", "writeSystem": "legacy-supabase", "writableSystems": ["legacy-supabase"]}, "steps": [{"id": "freeze-migration-writes", "action": "Disable migration swap mutations.", "verificationCommand": "node scripts/cutover-record-validator.mjs docs/migration/phase-10/cutover/shift-swaps.json"}, {"id": "restore-legacy-writes", "action": "Restore the legacy swap writer.", "verificationCommand": "node scripts/cutover-record-validator.mjs docs/migration/phase-10/cutover/shift-swaps.json"}, {"id": "restore-legacy-reads", "action": "Restore legacy swap reads.", "verificationCommand": "node scripts/cutover-record-validator.mjs docs/migration/phase-10/cutover/shift-swaps.json"}, {"id": "verify-authority", "action": "Verify one swap writer.", "verificationCommand": "node scripts/cutover-record-validator.mjs docs/migration/phase-10/cutover/shift-swaps.json"}, {"id": "verify-data", "action": "Compare request state, two changed rows, publication versions, and audit.", "verificationCommand": "node scripts/cutover-record-validator.mjs docs/migration/phase-10/cutover/shift-swaps.json"}]},
  "validation": {"asOf": "2026-09-18T08:00:00Z", "refreshMaxAgeHours": 24}
}
