{
  "$schema": "./cutover-record.schema.json",
  "schemaVersion": 1,
  "featureId": "leave-approval-workflows",
  "dataClassification": "synthetic",
  "status": {
    "current": "preparation",
    "changedAt": "2026-09-13T08:00:00Z",
    "history": [
      {
        "state": "preparation",
        "at": "2026-09-13T08:00:00Z",
        "reason": "Approval contract prepared; legacy decision and delegation writers remain authoritative."
      }
    ]
  },
  "dependencies": {
    "inventorySource": "docs/migration/phase-8/PART_8A_DEPENDENCY_INVENTORY.md",
    "requiredIds": [
      "phase8a-queue-read",
      "phase8a-delegation-read-write",
      "phase8a-rpc-manager-approve",
      "phase8a-rpc-manager-reject",
      "phase8a-delegate-function"
    ],
    "declared": [
      {
        "id": "phase8a-queue-read",
        "system": "legacy-supabase",
        "kind": "module",
        "locator": "src/utils/leaveStorage.js:533-600",
        "cutoverDisposition": "retain"
      },
      {
        "id": "phase8a-delegation-read-write",
        "system": "legacy-supabase",
        "kind": "module",
        "locator": "src/utils/leaveStorage.js:620-663",
        "cutoverDisposition": "retain"
      },
      {
        "id": "phase8a-rpc-manager-approve",
        "system": "legacy-supabase",
        "kind": "data-contract",
        "locator": "src/utils/leaveStorage.js:602-608",
        "cutoverDisposition": "retain"
      },
      {
        "id": "phase8a-rpc-manager-reject",
        "system": "legacy-supabase",
        "kind": "data-contract",
        "locator": "src/utils/leaveStorage.js:610-618",
        "cutoverDisposition": "retain"
      },
      {
        "id": "phase8a-delegate-function",
        "system": "migration-fastapi",
        "kind": "data-contract",
        "locator": "backend/alembic/versions/c74f5e9b2a31_add_leave_rls.py:28,127-203",
        "cutoverDisposition": "freeze"
      }
    ]
  },
  "authority": {
    "readSystem": "legacy-supabase",
    "writeSystem": "legacy-supabase",
    "writableSystems": [
      "legacy-supabase"
    ]
  },
  "freeze": {
    "read": {
      "system": "migration-fastapi",
      "condition": "Migration queues and audit reads are not connected.",
      "releaseCondition": "Phase 8F proves direct-report and active-delegation scope.",
      "verificationCommand": "python scripts/verify-phase-8a-contract.py"
    },
    "write": {
      "system": "migration-fastapi",
      "condition": "No migration decision, delegation, or audit writer exists.",
      "releaseCondition": "Phase 8F passes transition, separation, concurrency, and audit checks.",
      "verificationCommand": "node scripts/cutover-record-validator.mjs docs/migration/phase-8/cutover/leave-approval-workflows.json"
    }
  },
  "refresh": {
    "mode": "synthetic-only",
    "source": {
      "kind": "tracked-fixture",
      "locator": "docs/migration/phase-8/PART_8A_DOMAIN_CONTRACT.md",
      "digest": "sha256:9de8058d41693f4297f721324d7d947b0ee00b673dd5bae030400ef1ee245819"
    },
    "command": "python scripts/verify-phase-8a-contract.py",
    "lastRefresh": {
      "timestamp": "2026-09-13T16:24:36Z",
      "command": "python scripts/verify-phase-8a-contract.py",
      "sourceDigest": "sha256:9de8058d41693f4297f721324d7d947b0ee00b673dd5bae030400ef1ee245819",
      "evidence": {
        "path": "docs/migration/phase-8/cutover/evidence-leave-approval-workflows.json",
        "sha256": "sha256:236684480b3282648d10eb03d127ed2c7e12438f6ed5e179c2051e4766c5bc6f"
      }
    }
  },
  "identityMapping": {
    "mode": "synthetic-only",
    "legacyIdField": "legacySupabaseUserId",
    "applicationIdField": "applicationUserId",
    "requiredLegacyUserIds": [
      "11111111-1111-4111-8111-111111111111"
    ],
    "mappings": [
      {
        "legacySupabaseUserId": "11111111-1111-4111-8111-111111111111",
        "applicationUserId": "aaaaaaaa-aaaa-4aaa-8aaa-aaaaaaaaaaa1",
        "synthetic": true
      }
    ]
  },
  "rollback": {
    "trigger": "Queue scope, decision transition, delegation, concurrency, or audit proof fails.",
    "owner": "phase-owner",
    "targetAuthority": {
      "readSystem": "legacy-supabase",
      "writeSystem": "legacy-supabase",
      "writableSystems": [
        "legacy-supabase"
      ]
    },
    "steps": [
      {
        "id": "freeze-migration-writes",
        "action": "Disable migration decisions, delegation, and audit writes.",
        "verificationCommand": "python scripts/verify-phase-8a-contract.py"
      },
      {
        "id": "restore-legacy-writes",
        "action": "Restore legacy decision and delegation writers as sole writers.",
        "verificationCommand": "node scripts/cutover-record-validator.mjs docs/migration/phase-8/cutover/leave-approval-workflows.json"
      },
      {
        "id": "restore-legacy-reads",
        "action": "Route queues and audit views back to legacy reads.",
        "verificationCommand": "node scripts/cutover-record-validator.mjs docs/migration/phase-8/cutover/leave-approval-workflows.json"
      },
      {
        "id": "verify-authority",
        "action": "Recheck direct-report, delegation, branch, and actor separation.",
        "verificationCommand": "python scripts/verify-phase-8a-contract.py"
      },
      {
        "id": "verify-data",
        "action": "Compare synthetic request, balance, delegation, and audit state.",
        "verificationCommand": "python scripts/verify-phase-8a-contract.py"
      }
    ]
  },
  "validation": {
    "asOf": "2026-09-13T16:24:36Z",
    "refreshMaxAgeHours": 24
  }
}
